<?xml version="1.0" encoding="iso-8859-1"?>
<!DOCTYPE report-definition
  PUBLIC "-//JFreeReport//DTD report definition//EN//extended"
         "http://jfreereport.sourceforge.net/extreport.dtd">
<report-definition name="Business-cards">
  <parser-config>
    <object-factory class="com.jrefinery.report.io.ext.factory.datasource.DataSourceCollector"/>
    <object-factory class="com.jrefinery.report.io.ext.factory.objects.DefaultClassFactory"/>
    <element-factory class="com.jrefinery.report.io.ext.factory.elements.DefaultElementFactory"/>
    <stylekey-factory class="com.jrefinery.report.io.ext.factory.stylekey.DefaultStyleKeyFactory"/>
    <stylekey-factory class="com.jrefinery.report.io.ext.factory.stylekey.PageableLayoutStyleKeyFactory"/>
    <template-factory class="com.jrefinery.report.io.ext.factory.templates.DefaultTemplateCollection"/>
    <datasource-factory class="com.jrefinery.report.io.ext.factory.datasource.DefaultDataSourceFactory"/>
  </parser-config>

  <report-config>
    <defaultpageformat orientation="portrait" pageformat="A4" topmargin="72" bottommargin="72" leftmargin="20" rightmargin="25"/>
    <configuration>
      <property name="com.jrefinery.report.targets.pageable.output.PDFOutputTarget.default.Author">Darkwing Duck</property>
      <property name="com.jrefinery.report.targets.pageable.output.PDFOutputTarget.default.Encoding">iso-8859-15</property>
    </configuration>
  </report-config>

  <styles>
    <!-- Defines the global style for all bands -->
    <style name="default-band">
      <compound-key name="min-size">
        <basic-object name="width">275</basic-object>
        <basic-object name="height">139.6</basic-object>
      </compound-key>
      <compound-key name="max-size">
        <basic-object name="width">275</basic-object>
        <basic-object name="height">139.6</basic-object>
      </compound-key>
    </style>

    <!-- Defines the global style for all bands -->
    <style name="right-band">
      <extends name="default-band"/>
      <compound-key name="absolute_pos">
        <basic-object name="x">275</basic-object>
        <basic-object name="y">0</basic-object>
      </compound-key>
    </style>

    <!-- Defines the global style for all bands -->
    <style name="left-band">
      <extends name="default-band"/>
      <compound-key name="absolute_pos">
        <basic-object name="x">0</basic-object>
        <basic-object name="y">0</basic-object>
      </compound-key>
    </style>

    <!-- Defines the global style for all labels within the bands -->
    <style name="card-label">
      <basic-key name="font">Serif</basic-key>
      <basic-key name="font-size">11</basic-key>
      <basic-key name="font-bold">true</basic-key>
      <basic-key name="valignment">middle</basic-key>
      <compound-key name="min-size">
        <basic-object name="width">55</basic-object>
        <basic-object name="height">15</basic-object>
      </compound-key>
    </style>

    <!-- Defines the global style for all data fields within the bands -->
    <style name="card-field">
      <basic-key name="font">SansSerif</basic-key>
      <basic-key name="font-size">11</basic-key>
      <basic-key name="font-italic">true</basic-key>
      <basic-key name="valignment">middle</basic-key>
      <compound-key name="min-size">
        <basic-object name="width">70</basic-object>
        <basic-object name="height">15</basic-object>
      </compound-key>
    </style>

    <!-- Defines a common style for all grey backgrounds -->
    <style name="background">
      <basic-key name="fill-shape">true</basic-key>
      <basic-key name="draw-shape">false</basic-key>
      <basic-key name="paint">lightGray</basic-key>
      <basic-key name="scale">true</basic-key>
      <basic-key name="keepAspectRatio">false</basic-key>
    </style>

    <style name="expire-background">
      <extends name="background"/>
      <compound-key name="min-size">
        <basic-object name="width">-100</basic-object>
        <basic-object name="height">20</basic-object>
      </compound-key>
      <compound-key name="absolute_pos">
        <basic-object name="x">0</basic-object>
        <basic-object name="y">119</basic-object>
      </compound-key>
    </style>

    <style name="expire-label">
      <extends name="card-label"/>
      <compound-key name="min-size">
        <basic-object name="width">145</basic-object>
        <basic-object name="height">20</basic-object>
      </compound-key>
      <compound-key name="absolute_pos">
        <basic-object name="x">0</basic-object>
        <basic-object name="y">119</basic-object>
      </compound-key>
    </style>

    <style name="expire-field">
      <compound-key name="min-size">
        <basic-object name="width">100</basic-object>
        <basic-object name="height">20</basic-object>
      </compound-key>
      <compound-key name="absolute_pos">
        <basic-object name="x">150</basic-object>
        <basic-object name="y">119</basic-object>
      </compound-key>
    </style>

    <!--
      All Labels start at x=10, have a width of 45.
      All Fields start at x=60, have a width of 90

      For the second column fields add 150 to the values above
    -->
    <!-- Last name and first name -->
    <style name="name-field">
      <extends name="card-field"/>
      <compound-key name="absolute_pos">
        <!-- label starts @ 5, width = 55, so the field starts at 60 -->
        <basic-object name="x">60</basic-object>
        <basic-object name="y">65</basic-object>
      </compound-key>
      <!-- This field spans the whole card -->
      <compound-key name="min-size">
        <basic-object name="width">215</basic-object>
        <basic-object name="height">15</basic-object>
      </compound-key>
    </style>

    <style name="name-label">
      <extends name="card-label"/>
      <compound-key name="absolute_pos">
        <basic-object name="x">5</basic-object>
        <basic-object name="y">65</basic-object>
      </compound-key>
    </style>

    <!-- login -->
    <style name="login-field">
      <extends name="card-field"/>
      <compound-key name="absolute_pos">
        <basic-object name="x">60</basic-object>
        <basic-object name="y">80</basic-object>
      </compound-key>
    </style>

    <style name="login-label">
      <extends name="card-label"/>
      <compound-key name="absolute_pos">
        <basic-object name="x">5</basic-object>
        <basic-object name="y">80</basic-object>
      </compound-key>
    </style>

    <!-- Password -->
    <style name="password-field">
      <extends name="card-field"/>
      <compound-key name="absolute_pos">
        <basic-object name="x">197.5</basic-object>
        <basic-object name="y">80</basic-object>
      </compound-key>
    </style>

    <style name="password-label">
      <extends name="card-label"/>
      <compound-key name="absolute_pos">
        <basic-object name="x">142.5</basic-object>
        <basic-object name="y">80</basic-object>
      </compound-key>
    </style>

    <!-- Card-Nr. -->
    <style name="cardnr-field">
      <extends name="card-field"/>
      <compound-key name="absolute_pos">
        <basic-object name="x">60</basic-object>
        <basic-object name="y">95</basic-object>
      </compound-key>
    </style>

    <style name="cardnr-label">
      <extends name="card-label"/>
      <compound-key name="absolute_pos">
        <basic-object name="x">5</basic-object>
        <basic-object name="y">95</basic-object>
      </compound-key>
    </style>

  </styles>

  <templates>
    <template name="default-date-field" references="date-field">
      <basic-object name="format">yyyy-mm-dd</basic-object>
      <basic-object name="nullValue"></basic-object>
    </template>

    <!-- Templates for the first Column -->
    <template name="expire-field-1-template" references="default-date-field">
      <basic-object name="field">C1_expires</basic-object>
    </template>

    <template name="name-field-1-template" references="string-field">
      <basic-object name="field">C1_name_concat</basic-object>
    </template>

    <template name="login-field-1-template" references="string-field">
      <basic-object name="field">C1_login</basic-object>
    </template>

    <template name="password-field-1-template" references="string-field">
      <basic-object name="field">C1_password</basic-object>
    </template>

    <template name="cardnr-field-1-template" references="string-field">
      <basic-object name="field">C1_cardNr</basic-object>
    </template>

    <!-- Templates for the second column -->
    <template name="expire-field-2-template" references="default-date-field">
      <basic-object name="field">C2_expires</basic-object>
    </template>

    <template name="name-field-2-template" references="string-field">
      <basic-object name="field">C2_name_concat</basic-object>
    </template>

    <template name="login-field-2-template" references="string-field">
      <basic-object name="field">C2_login</basic-object>
    </template>

    <template name="password-field-2-template" references="string-field">
      <basic-object name="field">C2_password</basic-object>
    </template>

    <template name="cardnr-field-2-template" references="string-field">
      <basic-object name="field">C2_cardNr</basic-object>
    </template>

    <!-- Labels are shared among the columns -->
    <template name="expire-label-template" references="label">
      <basic-object name="content">This card expires on:</basic-object>
    </template>

    <template name="name-label-template" references="label">
      <basic-object name="content">Name :</basic-object>
    </template>

    <template name="password-label-template" references="label">
      <basic-object name="content">Password :</basic-object>
    </template>

    <template name="login-label-template" references="label">
      <basic-object name="content">Login :</basic-object>
    </template>